{
  "$schema": "https://json-schema.org/draft/2020-12/schema",
  "type": "object",
  "additionalProperties": false,
  "required": ["ok", "data", "error", "meta"],
  "properties": {
    "ok": { "const": true },
    "data": {
      "type": "object",
      "additionalProperties": false,
      "required": ["attempt"],
      "properties": {
        "attempt": {
          "type": "object",
          "additionalProperties": false,
          "required": [
            "attempt_id", "state", "sequence", "debrief_completed_at"
          ],
          "properties": {
            "attempt_id": {
              "type": "string",
              "pattern": "^[A-Za-z0-9_-]{43}$"
            },
            "state": { "const": "debrief_complete" },
            "sequence": { "const": 3 },
            "debrief_completed_at": {
              "type": "string",
              "pattern": "^\\d{4}-\\d{2}-\\d{2}T\\d{2}:\\d{2}:\\d{2}\\.\\d{3}Z$"
            }
          }
        }
      }
    },
    "error": { "type": "null" },
    "meta": {
      "type": "object",
      "additionalProperties": false,
      "required": ["request_id", "api_version"],
      "properties": {
        "request_id": {
          "type": "string",
          "pattern": "^[0-9a-f]{8}-[0-9a-f]{4}-[1-5][0-9a-f]{3}-[89ab][0-9a-f]{3}-[0-9a-f]{12}$"
        },
        "api_version": { "const": "v1" }
      }
    }
  }
}
